<?xml version="1.0" encoding="UTF-8"?>
<xs:schema xmlns:xs="http://www.w3.org/2001/XMLSchema" elementFormDefault="qualified">
    <xs:complexType name="person_type">
        <xs:sequence>
            <xs:element name="id" type="xs:positiveInteger"/>
            <xs:element name="first" type="xs:string"/>
            <xs:element name="last" type="xs:string"/>
            <xs:element name="phone">
                <xs:simpleType>
                    <xs:restriction base="xs:string">
                        <xs:pattern value="\d{3}-\d{3}-\d{4}"/>
                    </xs:restriction>
                </xs:simpleType>
            </xs:element>
        </xs:sequence>
    </xs:complexType>
    
    <xs:complexType name="people_type">
        <xs:sequence>
            <xs:element ref="person" minOccurs="0" maxOccurs="unbounded"/>
        </xs:sequence>
    </xs:complexType>
    
    <xs:element name="person" type="person_type"/>
    <xs:element name="people" type="people_type"/>
</xs:schema>
